indicator,source,series_id,countries,year_min,year_max,license,direction,anchor,coverage_pct,flags
fe_collinearity_falsifier_DATACORR,data-stage correlation carried flag (Foreclosed Exit),n/a (note row),n/a,,,n/a,n/a (note row),n/a (note row),n/a,"CARRIED FLAG for data-stage correlation screen: Foreclosed-Exit-exit-cost (D1 labour-market monopsony) vs Economic Structure & Demand DEMAND signals + ESD's product-market buyer-concentration (esd_d3) COLLINEARITY FALSIFIER. Conceptual case = independent variation (Naidu et al. 2016; Manning). The data-stage screen must compute the correlation BEFORE freeze: if r high, flag MERGE of Foreclosed Exit into Economic Structure & Demand for review (docs/METHODS.md §9.1). Reuse the governance-section collinearity method (rule 8). NOTE: D1 spine being unsourceable (row above) may make this falsifier untestable directly -- if so the merge call rests on the proxy outcome, flag jointly. Pending decision."
fe_d1_monopsony_exit_cost_spine,(unsourceable at 195 scale -- flagged for review; source need documented),NONE (wb_labor_productivity is NOT a monopsony measure),0,,,n/a,high_risk (more labour-market concentration / higher exit cost = more risk),n/a (no loaded concentration signal),0.0,"GAP / FLAGGED FOR REVIEW: D1 monopsony / exit-cost structure is the domain's NAMED GENERATING SPINE (scored only here) and is FLAGGED UNSOURCEABLE at 195-country scale (docs/METHODS.md §9.3 / flag 3). The crosswalk's wb_labor_productivity is output-per-worker, NOT labour-market concentration -- do NOT substitute it for the spine. OPEN DECISION standalone-low-confidence (keep D2/D3/D4 + Z-defeaters, spine unmeasured) VS fold-in (prevalence-proxy flip: route into Economic Structure & Demand + State Production) -- pending decision at data-stage review, NOT decided here. Source need documented in docs/data-provenance.md. S1.2 isolation / S1.3 legal-switching-cost equally unmapped."
fe_d234_exit_wage_contractor_gaps,(unmapped -- bespoke gaps; source needs documented),NONE,0,,,n/a,high_risk (less functioning exit / wider wage-coercion room / more insulating contracting = more risk),n/a (no loaded country signals),0.0,"GAP / LOW-CONFIDENCE: D2 functioning exit/grievance mechanisms, D3 wage-structure coercion CAPACITY (legal room for withholding/deferral/in-kind/deposit -- the ROOM, never a victim count), D4 supervising/insulating labour contractor -- all need legal-architecture coding with NO loaded connector. NOT mapped -- do NOT proxy. Enforcement-effectiveness gap documented (docs/data-provenance.md); macro framing documented (docs/data-provenance.md). docs/METHODS.md §3/§9."
fe_z1_exit_rights_enforcement_belowfloor,methodology verification (Foreclosed Exit),LAI_INDE_NOC_RT_A (ilostat),83,2010,2024,CC BY 4.0 (ILO open data),"register codes low_risk (more inspectors = more enforcement = less risk); methods Z1 defeater attenuate-only, sign-flip WITHHELD (evidence insufficient) -- direction OK on form.","[0,3] inspectors per 10,000 employed -- absolute-anchored, rule-1 OK",42.6,"NOTE-ROW (verify-only; ilostat fragment unchanged). Z1 exit-rights-enforcement proxied by LAI_INDE at 42.6% = BELOW the rule-9 50% coverage floor -> LOW-CONFIDENCE. KEEP-vs-DROP is a data-stage call, pending decision (not decided here). Inspector COUNT is a weak proxy for exit-SPECIFIC enforcement + penalty-free right to resign (docs/METHODS.md §5.1); enforcement-effectiveness evidence gap documented (docs/data-provenance.md). Below-floor: never impute, never missing->0. If dropped, Z1 defeater is unmeasured -> hazard runs un-attenuated (raises domain scores) -- flag the directional consequence for review."
fe_z2_collective_voice_verified_note,methodology verification (Foreclosed Exit),ILR_CBCT_NOC_RT_A + ILR_TUMT_NOC_RT_A (ilostat),99 / 135,2007,2020,CC BY 4.0 (ILO open data),ILOSTAT register codes BOTH low_risk (more CB coverage/union density = less risk). Methods Z2 is a DEFEATER (attenuate-only) where evidenced (agriculture/WSR) -> protective direction is CONSISTENT.,"[0,100] % covered / % unionised -- absolute-anchored, rule-1 OK",ILR_CBCT 50.8 / ILR_TUMT 69.2,"NOTE-ROW (verify-only; ilostat fragment unchanged). Z2 collective-voice anchor+direction CONFIRMED rule-1 conformant. ILR_CBCT at 50.8% sits JUST above the 50% floor -- coverage thin, keep but flag. Z2 as a defeater is SECTOR-RESTRICTED to agriculture/WSR (docs/METHODS.md §5.2); broader extension unevidenced. Suppression face encodes as ABSENCE-of-attenuation (rule-4 forbids mass-adding amplification) -- flagged for review (docs/METHODS.md §9a). The two signals avg equal-weight per rule 2."
fe_z4_governance_scoreonce_note,methodology verification (Foreclosed Exit),wb_wgi_rule_of_law (worldbank) / v2x_rule (vdem) -- SHARED backbone,194 / 173,2024,2025,CC BY 4.0,"low_risk backbone, entered as attenuate-only COMPLEMENT q=1-corruption on the Z1 defeater (docs/METHODS.md §5.4, SPU-r4) -- never hazard-additive.","WGI [-2.5,2.5]; v2x_rule [0,1] -- rule-1 OK (shared)",99.5 / 88.7,"NOTE-ROW (verify-only; worldbank/vdem fragments unchanged). Z4 is the SHARED general-governance signal, SCORED ONCE (governance rules 1-2, rule 8). Placed once as a complement-modulator on Z1 (q=1-corruption). FLAGGED PLACEMENT EXCEPTION (docs/METHODS.md §7/§8): the Z1 dial + its Z4 complement are seated at DOMAIN level (not rule-4-nominal indicator level) precisely to keep the shared signal entered once -- confirm preferred over per-indicator seating (open question). Data-stage correlation/collinearity check (rule 8) governs whether this stays distinct from sibling-domain governance modulators."
